{
  "schemaVersion": 1,
  "releaseId": "release-20260716-001",
  "environment": "production",
  "phase": "PRE_MIGRATION",
  "policy": {
    "backupMaxAgeHours": 24,
    "restoreDrillMaxAgeHours": 720,
    "jobsObservationMaxAgeMinutes": 5,
    "rollbackReviewMaxAgeHours": 24
  },
  "backup": {
    "backupId": "backup-contract-sample",
    "createdAt": "2026-07-16T06:00:00Z",
    "verifiedAt": "2026-07-16T07:00:00Z",
    "restoreDrill": {
      "performedAt": "2026-07-15T06:00:00Z",
      "result": "PASS",
      "evidenceRef": ".artifacts/tke/releases/release-20260716-001/evidence/restore-drill.json"
    }
  },
  "jobsSingleActive": {
    "lighthouseState": "ACTIVE",
    "tkeState": "STOPPED",
    "activeSide": "LIGHTHOUSE",
    "leaseBackend": "redis",
    "leaseOwner": "lighthouse-jobs-release-20260716-001",
    "expectedLeaseOwner": "lighthouse-jobs-release-20260716-001",
    "fencingToken": 41,
    "previousFencingToken": 40,
    "observedAt": "2026-07-16T08:20:00Z",
    "leaseExpiresAt": "2026-07-16T08:30:00Z",
    "evidenceRef": ".artifacts/tke/releases/release-20260716-001/evidence/jobs-lease.json"
  },
  "migration": {
    "plannedRunId": "migration-20260716-001",
    "conflictingRunIds": []
  },
  "rollbackReadiness": {
    "reviewedAt": "2026-07-16T08:00:00Z",
    "result": "PASS",
    "evidenceRef": ".artifacts/tke/releases/release-20260716-001/evidence/rollback-readiness.json"
  }
}
